{
  "id": "018-multi-prodotto-servizio-missing",
  "tags": [
    "multi_request",
    "missing_qty",
    "formal"
  ],
  "specRefs": [
    "§6-multi",
    "§7.2-14",
    "§7.2-13"
  ],
  "email": {
    "messageId": "<018-multi-prodotto-servizio-missing@mail.example.it>",
    "to": "preventivi@officine-fittizie.example",
    "subject": "Tapis roulant e manutenzione",
    "receivedAt": "2026-10-13T9:00:00+02:00",
    "body": "Salve, gestisco la Palestra Atlante a Bari. Vorrei preventivo per dei tapis roulant nuovi e, separatamente, per un contratto di manutenzione annuale delle macchine esistenti (circa 25). P.IVA 00000770248. Tommaso Greco",
    "from": "Tommaso Greco <tommaso.greco@palestra-atlante.example>"
  },
  "expected": {
    "classification": "richiesta_preventivo",
    "lead": {
      "fullName": "Tommaso Greco",
      "title": null,
      "company": "Palestra Atlante",
      "email": "tommaso.greco@palestra-atlante.example",
      "phone": null,
      "productOrService": "tapis roulant + manutenzione annuale",
      "quantity": null,
      "urgency": null,
      "missingFields": [
        "quantity"
      ],
      "source": "email",
      "originalLanguage": "it",
      "vatNumber": "00000770248"
    },
    "requests": [
      {
        "productOrService": "tapis roulant",
        "quantity": null
      },
      {
        "productOrService": "contratto manutenzione annuale macchine",
        "quantity": "25"
      }
    ],
    "missingFields": [
      "quantity"
    ],
    "draft": {
      "register": "lei",
      "language": "it",
      "mustAsk": [
        "quantity"
      ],
      "mustNotInventPrices": true,
      "allowedAmounts": [],
      "mustListItemsAsBullets": true,
      "mustAskPriority": true,
      "mustMention": [
        "tapis roulant",
        "manutenzione"
      ],
      "mustNotMention": [],
      "autonomousSend": false,
      "mustNotAskVatNumber": true,
      "piiCheck": true
    },
    "flow": {
      "praticaAction": "create",
      "crmUpsertExpected": 1,
      "expectedStatusAfterPipeline": "draft_ready",
      "telegramButtons": [
        "Approva",
        "Modifica",
        "Scarta"
      ],
      "sendAllowedOnlyAfterApprove": true,
      "praticheExpected": 1,
      "telegramLanguage": "it"
    }
  },
  "notes": "",
  "tenantConfig": {
    "requireVatNumber": false
  }
}