{
  "id": "007-missing-sede",
  "tags": [
    "missing_site",
    "formal"
  ],
  "specRefs": [
    "§6-dati-mancanti",
    "§7.2-13"
  ],
  "email": {
    "messageId": "<007-missing-sede@mail.example.it>",
    "to": "preventivi@officine-fittizie.example",
    "subject": "Preventivo installazione cappa",
    "receivedAt": "2026-10-14T16:00:00+02:00",
    "body": "Gentili,\nsono Chiara Pellizzari di Laboratori Arno Srl. Ci servirebbe l'installazione di 2 cappe chimiche aspiranti entro febbraio. P.IVA 03344550680.\nGrazie mille",
    "from": "Chiara Pellizzari <chiara.p@laboratori-arno.example>"
  },
  "expected": {
    "classification": "richiesta_preventivo",
    "lead": {
      "fullName": "Chiara Pellizzari",
      "title": null,
      "company": "Laboratori Arno Srl",
      "email": "chiara.p@laboratori-arno.example",
      "phone": null,
      "productOrService": "installazione cappe chimiche aspiranti",
      "quantity": "2",
      "urgency": "entro febbraio",
      "missingFields": [
        "deliverySite"
      ],
      "source": "email",
      "originalLanguage": "it",
      "vatNumber": "03344550680"
    },
    "requests": [
      {
        "productOrService": "installazione cappe chimiche aspiranti",
        "quantity": "2"
      }
    ],
    "missingFields": [
      "deliverySite"
    ],
    "draft": {
      "register": "lei",
      "language": "it",
      "mustAsk": [
        "deliverySite"
      ],
      "mustNotInventPrices": true,
      "allowedAmounts": [],
      "mustListItemsAsBullets": false,
      "mustAskPriority": false,
      "mustMention": [],
      "mustNotMention": [],
      "autonomousSend": false,
      "expectedSalutationContains": "Gentile Signora Pellizzari",
      "mustNotAskVatNumber": true,
      "piiCheck": true
    },
    "flow": {
      "praticaAction": "create",
      "crmUpsertExpected": 1,
      "expectedStatusAfterPipeline": "draft_ready",
      "telegramButtons": [
        "Approva",
        "Modifica",
        "Scarta"
      ],
      "sendAllowedOnlyAfterApprove": true,
      "telegramLanguage": "it"
    }
  },
  "notes": "",
  "tenantConfig": {
    "requireVatNumber": false
  }
}