{
  "id": "009-missing-prodotto",
  "tags": [
    "missing_product",
    "formal",
    "vague"
  ],
  "specRefs": [
    "§6-dati-mancanti",
    "§7.2-13",
    "§4.1-productOrService"
  ],
  "email": {
    "messageId": "<009-missing-prodotto@mail.example.it>",
    "to": "preventivi@officine-fittizie.example",
    "subject": "Informazioni e preventivo",
    "receivedAt": "2026-10-13T9:00:00+02:00",
    "body": "Buongiorno, ho visto il vostro sito e vorrei ricevere un preventivo per il nostro hotel. Potete ricontattarmi?\nFederica Lanza\nHotel Belvedere sul Lago - Stresa\n0323 000444",
    "from": "Federica Lanza <federica.lanza@hotel-belvedere-lago.example>"
  },
  "expected": {
    "classification": "richiesta_preventivo",
    "lead": {
      "fullName": "Federica Lanza",
      "title": null,
      "company": "Hotel Belvedere sul Lago",
      "email": "federica.lanza@hotel-belvedere-lago.example",
      "phone": "0323 000444",
      "productOrService": null,
      "quantity": null,
      "urgency": null,
      "missingFields": [
        "productOrService",
        "quantity"
      ],
      "source": "email",
      "originalLanguage": "it",
      "vatNumber": null
    },
    "requests": [
      {
        "productOrService": null,
        "quantity": null
      }
    ],
    "missingFields": [
      "productOrService",
      "quantity"
    ],
    "draft": {
      "register": "lei",
      "language": "it",
      "mustAsk": [
        "productOrService",
        "quantity"
      ],
      "mustNotInventPrices": true,
      "allowedAmounts": [],
      "mustListItemsAsBullets": false,
      "mustAskPriority": false,
      "mustMention": [],
      "mustNotMention": [],
      "autonomousSend": false,
      "expectedSalutationContains": "Gentile Signora Lanza",
      "note": "productOrService assente: la bozza chiede cosa serve; non propone prodotti dal catalogo come fossero scelti.",
      "mustNotAskVatNumber": true,
      "piiCheck": true
    },
    "flow": {
      "praticaAction": "create",
      "crmUpsertExpected": 1,
      "expectedStatusAfterPipeline": "draft_ready",
      "telegramButtons": [
        "Approva",
        "Modifica",
        "Scarta"
      ],
      "sendAllowedOnlyAfterApprove": true,
      "telegramLanguage": "it"
    }
  },
  "notes": "",
  "tenantConfig": {
    "requireVatNumber": false
  }
}