{
  "id": "023-spam-phishing",
  "tags": [
    "spam",
    "phishing"
  ],
  "specRefs": [
    "§6-spam",
    "§7.2-15"
  ],
  "email": {
    "messageId": "<023-spam-phishing@mail.example.it>",
    "to": "preventivi@officine-fittizie.example",
    "subject": "Il suo conto è sospeso",
    "receivedAt": "2026-10-15T14:00:00+02:00",
    "body": "Gentile cliente, il suo conto è stato sospeso. Per riattivarlo inserisca le credenziali al link seguente entro 24 ore. Richiesta preventivo n. 2231 allegata.",
    "from": "Servizio Clienti Banca <sicurezza@banca-fittizia-verifica.example>"
  },
  "expected": {
    "classification": "spam",
    "lead": null,
    "requests": [],
    "missingFields": [],
    "draft": null,
    "flow": {
      "praticaAction": "create_skip",
      "crmUpsertExpected": 0,
      "expectedStatusAfterPipeline": "classified_skip",
      "telegramButtons": [
        "Approva",
        "Modifica",
        "Scarta"
      ],
      "sendAllowedOnlyAfterApprove": true,
      "telegramLanguage": "it"
    }
  },
  "notes": "Contiene la parola 'preventivo' come esca: non deve essere classificata richiesta_preventivo.",
  "tenantConfig": {
    "requireVatNumber": false
  }
}