{
  "id": "022-spam-newsletter",
  "tags": [
    "spam"
  ],
  "specRefs": [
    "§6-spam",
    "§7.2-15"
  ],
  "email": {
    "messageId": "<022-spam-newsletter@mail.example.it>",
    "to": "preventivi@officine-fittizie.example",
    "subject": "-30% questo weekend",
    "receivedAt": "2026-10-14T13:00:00+02:00",
    "body": "Solo per te: -30% su tutto il catalogo fino a domenica! Clicca qui per approfittarne. Disiscriviti.",
    "from": "Shop Offerte <newsletter@shop.example>"
  },
  "expected": {
    "classification": "spam",
    "lead": null,
    "requests": [],
    "missingFields": [],
    "draft": null,
    "flow": {
      "praticaAction": "create_skip",
      "crmUpsertExpected": 0,
      "expectedStatusAfterPipeline": "classified_skip",
      "telegramButtons": [
        "Approva",
        "Modifica",
        "Scarta"
      ],
      "sendAllowedOnlyAfterApprove": true,
      "telegramLanguage": "it"
    }
  },
  "notes": "",
  "tenantConfig": {
    "requireVatNumber": false
  }
}