{
  "id": "004-completo-software",
  "tags": [
    "complete",
    "formal",
    "service"
  ],
  "specRefs": [
    "§7.2-11",
    "§7.2-12",
    "§7.2-17"
  ],
  "email": {
    "messageId": "<004-completo-software@mail.example.it>",
    "to": "preventivi@officine-fittizie.example",
    "subject": "Richiesta offerta licenze gestionale",
    "receivedAt": "2026-10-14T13:00:00+02:00",
    "body": "Salve,\nsono Marco De Santis di Ortofrutta del Sole Soc. Coop. Vorremmo un'offerta per 12 licenze del vostro gestionale magazzino con installazione presso la sede di Vittoria (RG). Avvio previsto a marzo 2027.\nP.IVA 00000630467\nCordialmente",
    "from": "Marco De Santis <marco.desantis@ortofrutta-sole.example>"
  },
  "expected": {
    "classification": "richiesta_preventivo",
    "lead": {
      "fullName": "Marco De Santis",
      "title": null,
      "company": "Ortofrutta del Sole Soc. Coop.",
      "email": "marco.desantis@ortofrutta-sole.example",
      "phone": null,
      "productOrService": "licenze gestionale magazzino con installazione",
      "quantity": "12",
      "urgency": "marzo 2027",
      "missingFields": [],
      "source": "email",
      "originalLanguage": "it",
      "vatNumber": "00000630467"
    },
    "requests": [
      {
        "productOrService": "licenze gestionale magazzino con installazione",
        "quantity": "12"
      }
    ],
    "missingFields": [],
    "draft": {
      "register": "lei",
      "language": "it",
      "mustAsk": [],
      "mustNotInventPrices": true,
      "allowedAmounts": [],
      "mustListItemsAsBullets": false,
      "mustAskPriority": false,
      "mustMention": [],
      "mustNotMention": [],
      "autonomousSend": false,
      "expectedSalutationContains": "Gentile Signor De Santis",
      "mustNotAskVatNumber": true,
      "piiCheck": true
    },
    "flow": {
      "praticaAction": "create",
      "crmUpsertExpected": 1,
      "expectedStatusAfterPipeline": "draft_ready",
      "telegramButtons": [
        "Approva",
        "Modifica",
        "Scarta"
      ],
      "sendAllowedOnlyAfterApprove": true,
      "telegramLanguage": "it"
    }
  },
  "notes": "",
  "tenantConfig": {
    "requireVatNumber": false
  }
}