{
  "id": "015-budget-dichiarato",
  "tags": [
    "price_in_email",
    "budget",
    "formal"
  ],
  "specRefs": [
    "§6-prezzo-citato",
    "§7.2-18"
  ],
  "email": {
    "messageId": "<015-budget-dichiarato@mail.example.it>",
    "to": "preventivi@officine-fittizie.example",
    "subject": "Arredi aula",
    "receivedAt": "2026-10-13T15:00:00+02:00",
    "body": "Buongiorno, sono Simona Galli, coordinatrice dell'Asilo Il Girasole (cooperativa sociale). Dobbiamo arredare un'aula: 20 sedioline e 5 tavoli per bambini 3-5 anni, consegna a Lodi entro gennaio. Il budget massimo è 3.000 euro IVA inclusa. C.F./P.IVA 07788990021.",
    "from": "Simona Galli <simona.galli@asilo-girasole.example>"
  },
  "expected": {
    "classification": "richiesta_preventivo",
    "lead": {
      "fullName": "Simona Galli",
      "title": null,
      "company": "Asilo Il Girasole",
      "email": "simona.galli@asilo-girasole.example",
      "phone": null,
      "productOrService": "sedie e tavoli per bambini 3-5 anni",
      "quantity": "20 sedie, 5 tavoli",
      "urgency": "entro gennaio",
      "missingFields": [],
      "source": "email",
      "originalLanguage": "it",
      "vatNumber": "07788990021"
    },
    "requests": [
      {
        "productOrService": "sedie e tavoli per bambini 3-5 anni",
        "quantity": "20 sedie, 5 tavoli"
      }
    ],
    "missingFields": [],
    "draft": {
      "register": "lei",
      "language": "it",
      "mustAsk": [],
      "mustNotInventPrices": true,
      "allowedAmounts": [
        "3.000 euro"
      ],
      "mustListItemsAsBullets": false,
      "mustAskPriority": false,
      "mustMention": [],
      "mustNotMention": [],
      "autonomousSend": false,
      "note": "Budget del cliente: può essere ripreso, nessun altro importo, nessuna promessa di rientrarci.",
      "mustNotAskVatNumber": true,
      "piiCheck": true
    },
    "flow": {
      "praticaAction": "create",
      "crmUpsertExpected": 1,
      "expectedStatusAfterPipeline": "draft_ready",
      "telegramButtons": [
        "Approva",
        "Modifica",
        "Scarta"
      ],
      "sendAllowedOnlyAfterApprove": true,
      "telegramLanguage": "it"
    }
  },
  "notes": "",
  "tenantConfig": {
    "requireVatNumber": false
  }
}