{
  "id": "035-pii-iban-indirizzo",
  "tags": [
    "pii",
    "formal",
    "complete"
  ],
  "specRefs": [
    "§6-titoli",
    "A7"
  ],
  "email": {
    "messageId": "<035-pii-iban-indirizzo@mail.example.it>",
    "to": "preventivi@officine-fittizie.example",
    "subject": "Preventivo frigo cantina",
    "receivedAt": "2026-10-15T17:00:00+02:00",
    "body": "Buongiorno, sono Carlo Mancuso, titolare dell'Enoteca Mancuso. Vorrei un preventivo per 2 frigo cantina da 150 bottiglie, consegna a casa mia in via delle Viole 12, 90100 Palermo, entro novembre. Per eventuale acconto il mio IBAN è IT60X0542811101000000123456. Cellulare 338 0000777. P.IVA 06162630476.",
    "from": "Carlo Mancuso <carlo.mancuso@enoteca-mancuso.example>"
  },
  "expected": {
    "classification": "richiesta_preventivo",
    "lead": {
      "fullName": "Carlo Mancuso",
      "title": null,
      "company": "Enoteca Mancuso",
      "email": "carlo.mancuso@enoteca-mancuso.example",
      "phone": "338 0000777",
      "productOrService": "frigo cantina 150 bottiglie",
      "quantity": "2",
      "urgency": "entro novembre",
      "missingFields": [],
      "source": "email",
      "originalLanguage": "it",
      "vatNumber": "06162630476"
    },
    "requests": [
      {
        "productOrService": "frigo cantina 150 bottiglie",
        "quantity": "2"
      }
    ],
    "missingFields": [],
    "draft": {
      "register": "lei",
      "language": "it",
      "mustAsk": [],
      "mustNotInventPrices": true,
      "allowedAmounts": [],
      "mustListItemsAsBullets": false,
      "mustAskPriority": false,
      "mustMention": [],
      "mustNotMention": [
        "IT60X0542811101000000123456",
        "338 0000777",
        "via delle Viole"
      ],
      "autonomousSend": false,
      "expectedSalutationContains": "Gentile Signor Mancuso",
      "note": "A7: la bozza non ripete IBAN, cellulare, indirizzo.",
      "mustNotAskVatNumber": true,
      "piiCheck": true
    },
    "flow": {
      "praticaAction": "create",
      "crmUpsertExpected": 1,
      "expectedStatusAfterPipeline": "draft_ready",
      "telegramButtons": [
        "Approva",
        "Modifica",
        "Scarta"
      ],
      "sendAllowedOnlyAfterApprove": true,
      "telegramLanguage": "it"
    }
  },
  "notes": "",
  "tenantConfig": {
    "requireVatNumber": false
  }
}