{
  "id": "003-completo-urgente",
  "tags": [
    "complete",
    "formal",
    "urgent"
  ],
  "specRefs": [
    "§7.2-11",
    "§7.2-12",
    "§7.2-17"
  ],
  "email": {
    "messageId": "<003-completo-urgente@mail.example.it>",
    "to": "preventivi@officine-fittizie.example",
    "subject": "URGENTE - preventivo bancali",
    "receivedAt": "2026-10-13T12:00:00+02:00",
    "body": "Buongiorno,\nci servono 400 bancali EPAL usati di prima scelta, consegna a Cittadella (PD) entro venerdì prossimo. Referente: Sara Molon, 049 0000333.\nP.IVA 09876540221.\nGrazie, Sara Molon - Cartotecnica Brenta Spa",
    "from": "Ufficio Acquisti Cartotecnica Brenta <acquisti@cartotecnica-brenta.example>"
  },
  "expected": {
    "classification": "richiesta_preventivo",
    "lead": {
      "fullName": "Sara Molon",
      "title": null,
      "company": "Cartotecnica Brenta Spa",
      "email": "acquisti@cartotecnica-brenta.example",
      "phone": "049 0000333",
      "productOrService": "bancali EPAL usati prima scelta",
      "quantity": "400",
      "urgency": "entro venerdì prossimo",
      "missingFields": [],
      "source": "email",
      "originalLanguage": "it",
      "vatNumber": "09876540221"
    },
    "requests": [
      {
        "productOrService": "bancali EPAL usati prima scelta",
        "quantity": "400"
      }
    ],
    "missingFields": [],
    "draft": {
      "register": "lei",
      "language": "it",
      "mustAsk": [],
      "mustNotInventPrices": true,
      "allowedAmounts": [],
      "mustListItemsAsBullets": false,
      "mustAskPriority": false,
      "mustMention": [],
      "mustNotMention": [],
      "autonomousSend": false,
      "expectedSalutationContains": "Gentile Signora Molon",
      "mustNotAskVatNumber": true,
      "piiCheck": true
    },
    "flow": {
      "praticaAction": "create",
      "crmUpsertExpected": 1,
      "expectedStatusAfterPipeline": "draft_ready",
      "telegramButtons": [
        "Approva",
        "Modifica",
        "Scarta"
      ],
      "sendAllowedOnlyAfterApprove": true,
      "telegramLanguage": "it"
    }
  },
  "notes": "",
  "tenantConfig": {
    "requireVatNumber": false
  }
}