{
  "id": "020-inglese",
  "tags": [
    "lang_en",
    "formal",
    "complete"
  ],
  "specRefs": [
    "§6-lingua",
    "A1"
  ],
  "email": {
    "messageId": "<020-inglese@mail.example.it>",
    "to": "preventivi@officine-fittizie.example",
    "subject": "Quote request - teak decking",
    "receivedAt": "2026-10-15T11:00:00+02:00",
    "body": "Hello,\nI'm James Whitfield from Harbour Yachts Ltd. We'd like a quote for 40 sqm of teak decking panels, delivered to our yard in La Spezia by end of January. VAT GB000000000.\nBest regards",
    "from": "James Whitfield <j.whitfield@harbour-yachts.example>"
  },
  "expected": {
    "classification": "richiesta_preventivo",
    "lead": {
      "fullName": "James Whitfield",
      "title": null,
      "company": "Harbour Yachts Ltd",
      "email": "j.whitfield@harbour-yachts.example",
      "phone": null,
      "productOrService": "pannelli teak decking",
      "quantity": "40 mq",
      "urgency": "entro fine gennaio",
      "missingFields": [],
      "source": "email",
      "originalLanguage": "en",
      "vatNumber": "GB000000000"
    },
    "requests": [
      {
        "productOrService": "pannelli teak decking",
        "quantity": "40 mq"
      }
    ],
    "missingFields": [],
    "draft": {
      "register": "formal_en",
      "language": "en",
      "mustAsk": [],
      "mustNotInventPrices": true,
      "allowedAmounts": [],
      "mustListItemsAsBullets": false,
      "mustAskPriority": false,
      "mustMention": [],
      "mustNotMention": [],
      "autonomousSend": false,
      "expectedSalutationContains": "Dear Mr Whitfield",
      "note": "A1: bozza nella lingua del cliente (inglese, registro formale). Scheda Telegram in italiano.",
      "mustNotAskVatNumber": true,
      "piiCheck": true
    },
    "flow": {
      "praticaAction": "create",
      "crmUpsertExpected": 1,
      "expectedStatusAfterPipeline": "draft_ready",
      "telegramButtons": [
        "Approva",
        "Modifica",
        "Scarta"
      ],
      "sendAllowedOnlyAfterApprove": true,
      "telegramLanguage": "it"
    },
    "telegramCard": {
      "mustNote": "lingua originale: inglese"
    }
  },
  "notes": "",
  "tenantConfig": {
    "requireVatNumber": false
  }
}