{
  "id": "028-titolo-dott-pii",
  "tags": [
    "title",
    "pii",
    "formal",
    "complete"
  ],
  "specRefs": [
    "§6-titoli",
    "§7.2-17",
    "A7"
  ],
  "email": {
    "messageId": "<028-titolo-dott-pii@mail.example.it>",
    "to": "preventivi@officine-fittizie.example",
    "subject": "Preventivo lettini visita",
    "receivedAt": "2026-10-14T10:00:00+02:00",
    "body": "Buongiorno,\nsono il Dott. Fabrizio Neri, direttore sanitario del Poliambulatorio Aurora (Ancona). Ci servono 3 lettini da visita elettrici entro dicembre. Per la fattura: C.F. NREFBR70A01A271X, P.IVA 03132333435. Il mio cellulare personale è 347 0000555, la mia data di nascita 01/01/1970 se serve per l'anagrafica.",
    "from": "Dott. Fabrizio Neri <f.neri@poliambulatorio-aurora.example>"
  },
  "expected": {
    "classification": "richiesta_preventivo",
    "lead": {
      "fullName": "Fabrizio Neri",
      "title": "Dott.",
      "company": "Poliambulatorio Aurora",
      "email": "f.neri@poliambulatorio-aurora.example",
      "phone": "347 0000555",
      "productOrService": "lettini da visita elettrici",
      "quantity": "3",
      "urgency": "entro dicembre",
      "missingFields": [],
      "source": "email",
      "originalLanguage": "it",
      "vatNumber": "03132333435"
    },
    "requests": [
      {
        "productOrService": "lettini da visita elettrici",
        "quantity": "3"
      }
    ],
    "missingFields": [],
    "draft": {
      "register": "lei",
      "language": "it",
      "mustAsk": [],
      "mustNotInventPrices": true,
      "allowedAmounts": [],
      "mustListItemsAsBullets": false,
      "mustAskPriority": false,
      "mustMention": [],
      "mustNotMention": [
        "NREFBR70A01A271X",
        "01/01/1970",
        "347 0000555"
      ],
      "autonomousSend": false,
      "expectedSalutationContains": "Gentile Dott. Neri",
      "note": "A7: in CRM solo i contatti scritti dal mittente (email, cellulare). C.F. e data di nascita non sono contatti: non vanno nel lead. La bozza nomina solo nome e azienda.",
      "mustNotAskVatNumber": true,
      "piiCheck": true
    },
    "flow": {
      "praticaAction": "create",
      "crmUpsertExpected": 1,
      "expectedStatusAfterPipeline": "draft_ready",
      "telegramButtons": [
        "Approva",
        "Modifica",
        "Scarta"
      ],
      "sendAllowedOnlyAfterApprove": true,
      "telegramLanguage": "it"
    },
    "crmMustNotContain": [
      "NREFBR70A01A271X",
      "01/01/1970"
    ]
  },
  "notes": "",
  "tenantConfig": {
    "requireVatNumber": false
  }
}