{
  "id": "001-completo-macchinari",
  "tags": [
    "complete",
    "formal",
    "no_price_in_email"
  ],
  "specRefs": [
    "§7.2-11",
    "§7.2-12",
    "§7.2-17",
    "§7.2-18",
    "§7.1-1",
    "§7.1-2"
  ],
  "email": {
    "messageId": "<001-completo-macchinari@mail.example.it>",
    "to": "preventivi@officine-fittizie.example",
    "subject": "Richiesta preventivo tornio CNC",
    "receivedAt": "2026-10-14T10:00:00+02:00",
    "body": "Buongiorno,\nsono Giulia Ferraresi, responsabile acquisti di Tornerie Valdorme Srl.\nVi chiediamo un preventivo per 2 torni CNC a 3 assi, consegna presso il nostro stabilimento di Fossano (CN) entro fine gennaio.\nP.IVA 00000610907. Tel. 0172 000111.\nCordiali saluti\nGiulia Ferraresi",
    "from": "Giulia Ferraresi <giulia.ferraresi@tornerie-valdorme.example>"
  },
  "expected": {
    "classification": "richiesta_preventivo",
    "lead": {
      "fullName": "Giulia Ferraresi",
      "title": null,
      "company": "Tornerie Valdorme Srl",
      "email": "giulia.ferraresi@tornerie-valdorme.example",
      "phone": "0172 000111",
      "productOrService": "tornio CNC 3 assi",
      "quantity": "2",
      "urgency": "entro fine gennaio",
      "missingFields": [],
      "source": "email",
      "originalLanguage": "it",
      "vatNumber": "00000610907"
    },
    "requests": [
      {
        "productOrService": "tornio CNC 3 assi",
        "quantity": "2"
      }
    ],
    "missingFields": [],
    "draft": {
      "register": "lei",
      "language": "it",
      "mustAsk": [],
      "mustNotInventPrices": true,
      "allowedAmounts": [],
      "mustListItemsAsBullets": false,
      "mustAskPriority": false,
      "mustMention": [],
      "mustNotMention": [],
      "autonomousSend": false,
      "expectedSalutationContains": "Gentile Signora Ferraresi",
      "mustNotAskVatNumber": true,
      "piiCheck": true
    },
    "flow": {
      "praticaAction": "create",
      "crmUpsertExpected": 1,
      "expectedStatusAfterPipeline": "draft_ready",
      "telegramButtons": [
        "Approva",
        "Modifica",
        "Scarta"
      ],
      "sendAllowedOnlyAfterApprove": true,
      "telegramLanguage": "it"
    }
  },
  "notes": "",
  "tenantConfig": {
    "requireVatNumber": false
  }
}