{
  "id": "008-missing-piva",
  "tags": [
    "vat_absent_default",
    "formal",
    "complete"
  ],
  "specRefs": [
    "§6-dati-mancanti",
    "§7.2-13",
    "A3"
  ],
  "email": {
    "messageId": "<008-missing-piva@mail.example.it>",
    "to": "preventivi@officine-fittizie.example",
    "subject": "Richiesta preventivo",
    "receivedAt": "2026-10-15T17:00:00+02:00",
    "body": "Buongiorno,\nper Ferramenta del Colle chiedo un preventivo per 50 cassette attrezzi in ABS, consegna a Siena, entro il mese. Per la fatturazione vi mando i dati in seguito.\nAndrea Ruggeri",
    "from": "Andrea Ruggeri <andrea.ruggeri@ferramenta-colle.example>"
  },
  "expected": {
    "classification": "richiesta_preventivo",
    "lead": {
      "fullName": "Andrea Ruggeri",
      "title": null,
      "company": "Ferramenta del Colle",
      "email": "andrea.ruggeri@ferramenta-colle.example",
      "phone": null,
      "productOrService": "cassette attrezzi in ABS",
      "quantity": "50",
      "urgency": "entro il mese",
      "missingFields": [],
      "source": "email",
      "originalLanguage": "it",
      "vatNumber": null
    },
    "requests": [
      {
        "productOrService": "cassette attrezzi in ABS",
        "quantity": "50"
      }
    ],
    "missingFields": [],
    "draft": {
      "register": "lei",
      "language": "it",
      "mustAsk": [],
      "mustNotInventPrices": true,
      "allowedAmounts": [],
      "mustListItemsAsBullets": false,
      "mustAskPriority": false,
      "mustMention": [],
      "mustNotMention": [],
      "autonomousSend": false,
      "expectedSalutationContains": "Gentile Signor Ruggeri",
      "mustNotAskVatNumber": true,
      "piiCheck": true,
      "note": "Tenant default (requireVatNumber=false): la P.IVA non si chiede anche se assente."
    },
    "flow": {
      "praticaAction": "create",
      "crmUpsertExpected": 1,
      "expectedStatusAfterPipeline": "draft_ready",
      "telegramButtons": [
        "Approva",
        "Modifica",
        "Scarta"
      ],
      "sendAllowedOnlyAfterApprove": true,
      "telegramLanguage": "it"
    }
  },
  "notes": "",
  "tenantConfig": {
    "requireVatNumber": false
  }
}