{
  "id": "019-allegato-citato-assente",
  "tags": [
    "attachment_missing",
    "formal"
  ],
  "specRefs": [
    "§6-allegati"
  ],
  "email": {
    "messageId": "<019-allegato-citato-assente@mail.example.it>",
    "to": "preventivi@officine-fittizie.example",
    "subject": "Richiesta preventivo da disegno",
    "receivedAt": "2026-10-14T10:00:00+02:00",
    "body": "Buongiorno,\nin allegato trovate il disegno tecnico con quantità e misure per le staffe in acciaio inox che ci servono. Consegna a Brescia entro dicembre. P.IVA 00000620328.\nNicola Ferri - Carpenteria Ferri Srl",
    "from": "Nicola Ferri <nicola.ferri@carpenteria-ferri.example>"
  },
  "expected": {
    "classification": "richiesta_preventivo",
    "lead": {
      "fullName": "Nicola Ferri",
      "title": null,
      "company": "Carpenteria Ferri Srl",
      "email": "nicola.ferri@carpenteria-ferri.example",
      "phone": null,
      "productOrService": "staffe in acciaio inox (da disegno)",
      "quantity": null,
      "urgency": "entro dicembre",
      "missingFields": [
        "quantity"
      ],
      "source": "email",
      "originalLanguage": "it",
      "vatNumber": "00000620328"
    },
    "requests": [
      {
        "productOrService": "staffe in acciaio inox (da disegno)",
        "quantity": null
      }
    ],
    "missingFields": [
      "quantity"
    ],
    "draft": {
      "register": "lei",
      "language": "it",
      "mustAsk": [
        "quantity"
      ],
      "mustNotInventPrices": true,
      "allowedAmounts": [],
      "mustListItemsAsBullets": false,
      "mustAskPriority": false,
      "mustMention": [],
      "mustNotMention": [
        "come da disegno",
        "nel disegno indicat"
      ],
      "autonomousSend": false,
      "note": "Allegati non letti in v1: la bozza non finge di averlo letto; può chiedere quantità/misure o dire che il commerciale lo esaminerà.",
      "mustNotAskVatNumber": true,
      "piiCheck": true
    },
    "flow": {
      "praticaAction": "create",
      "crmUpsertExpected": 1,
      "expectedStatusAfterPipeline": "draft_ready",
      "telegramButtons": [
        "Approva",
        "Modifica",
        "Scarta"
      ],
      "sendAllowedOnlyAfterApprove": true,
      "telegramLanguage": "it"
    },
    "telegramCard": {
      "mustNote": "allegato"
    }
  },
  "notes": "",
  "tenantConfig": {
    "requireVatNumber": false
  }
}