{
  "id": "027-reply-thread-nuova-richiesta",
  "tags": [
    "thread_reply",
    "multi_request"
  ],
  "specRefs": [
    "§6-thread",
    "§7.2-16",
    "§6-multi",
    "A5"
  ],
  "email": {
    "messageId": "<027-reply-thread-nuova-richiesta@mail.example.it>",
    "to": "preventivi@officine-fittizie.example",
    "subject": "Re: Preventivo attrezzature cucina",
    "receivedAt": "2026-10-13T9:00:00+02:00",
    "body": "Buongiorno, aggiungerei alla richiesta anche 1 macchina sottovuoto professionale. La priorità resta l'abbattitore. Grazie, Irene Basile",
    "threadId": "thr-017",
    "inReplyTo": "<sent-reply-017@officine-fittizie.example>",
    "references": [
      "<017-multi-prodotto@mail.example.it>",
      "<sent-reply-017@officine-fittizie.example>"
    ],
    "from": "Irene Basile <irene.basile@ristorante-due-ponti.example>"
  },
  "expected": {
    "classification": "risposta_thread",
    "lead": {
      "fullName": "Irene Basile",
      "title": null,
      "company": "Ristorante Due Ponti",
      "email": "irene.basile@ristorante-due-ponti.example",
      "phone": null,
      "productOrService": "attrezzature cucina (4 voci)",
      "quantity": null,
      "urgency": "entro metà dicembre",
      "missingFields": [],
      "source": "email",
      "originalLanguage": "it",
      "vatNumber": null
    },
    "requests": [
      {
        "productOrService": "abbattitore di temperatura 5 teglie",
        "quantity": "1"
      },
      {
        "productOrService": "frigorifero verticale 700 l",
        "quantity": "2"
      },
      {
        "productOrService": "lavastoviglie a capotta",
        "quantity": "1"
      },
      {
        "productOrService": "macchina sottovuoto professionale",
        "quantity": "1"
      }
    ],
    "missingFields": [],
    "draft": {
      "register": "lei",
      "language": "it",
      "mustAsk": [],
      "mustNotInventPrices": true,
      "allowedAmounts": [],
      "mustListItemsAsBullets": false,
      "mustAskPriority": false,
      "mustMention": [
        "sottovuoto"
      ],
      "mustNotMention": [],
      "autonomousSend": false,
      "note": "A5: upsertLead sullo stesso lead (stesso crmLeadId) con il prodotto aggiunto; nuova bozza da approvare.",
      "mustNotAskVatNumber": true,
      "piiCheck": true
    },
    "flow": {
      "praticaAction": "attach_to_existing",
      "crmUpsertExpected": 1,
      "expectedStatusAfterPipeline": "draft_ready",
      "telegramButtons": [
        "Approva",
        "Modifica",
        "Scarta"
      ],
      "sendAllowedOnlyAfterApprove": true,
      "existingPraticaRef": "017-multi-prodotto",
      "existingStatus": "sent",
      "telegramLanguage": "it",
      "leadUpdate": "same_lead_add_products",
      "newLeadExpected": 0
    },
    "telegramCard": {
      "header": "Nuova mail sul thread"
    }
  },
  "notes": "",
  "tenantConfig": {
    "requireVatNumber": false
  }
}