{
  "id": "021-misto-it-en",
  "tags": [
    "lang_mixed",
    "formal",
    "missing_site"
  ],
  "specRefs": [
    "§6-lingua",
    "§7.2-13",
    "A1"
  ],
  "email": {
    "messageId": "<021-misto-it-en@mail.example.it>",
    "to": "preventivi@officine-fittizie.example",
    "subject": "Preventivo standing desk",
    "receivedAt": "2026-10-13T12:00:00+02:00",
    "body": "Hi, buongiorno! Sono Laura Bassi, office manager di TechStart Milano Srl. We need 15 standing desks per il nuovo open space, ASAP please. P.IVA 02122232425. Thanks!",
    "from": "Laura Bassi <laura.bassi@techstart-milano.example>"
  },
  "expected": {
    "classification": "richiesta_preventivo",
    "lead": {
      "fullName": "Laura Bassi",
      "title": null,
      "company": "TechStart Milano Srl",
      "email": "laura.bassi@techstart-milano.example",
      "phone": null,
      "productOrService": "scrivanie regolabili in altezza (standing desk)",
      "quantity": "15",
      "urgency": "al più presto",
      "missingFields": [
        "deliverySite"
      ],
      "source": "email",
      "originalLanguage": "it+en",
      "vatNumber": "02122232425"
    },
    "requests": [
      {
        "productOrService": "scrivanie regolabili in altezza (standing desk)",
        "quantity": "15"
      }
    ],
    "missingFields": [
      "deliverySite"
    ],
    "draft": {
      "register": "lei",
      "language": "it",
      "mustAsk": [
        "deliverySite"
      ],
      "mustNotInventPrices": true,
      "allowedAmounts": [],
      "mustListItemsAsBullets": false,
      "mustAskPriority": false,
      "mustMention": [],
      "mustNotMention": [],
      "autonomousSend": false,
      "expectedSalutationContains": "Gentile Signora Bassi",
      "mustNotAskVatNumber": true,
      "piiCheck": true,
      "note": "A1: mail mista IT/EN con italiano presente -> default italiano (lei)."
    },
    "flow": {
      "praticaAction": "create",
      "crmUpsertExpected": 1,
      "expectedStatusAfterPipeline": "draft_ready",
      "telegramButtons": [
        "Approva",
        "Modifica",
        "Scarta"
      ],
      "sendAllowedOnlyAfterApprove": true,
      "telegramLanguage": "it"
    },
    "telegramCard": {
      "mustNote": "lingua originale"
    }
  },
  "notes": "",
  "tenantConfig": {
    "requireVatNumber": false
  }
}