{
  "id": "037-vat-estera-errata",
  "tags": [
    "wrong_vat",
    "lang_en",
    "formal"
  ],
  "specRefs": [
    "§6-lingua",
    "A1",
    "A3",
    "A7"
  ],
  "email": {
    "messageId": "<037-vat-estera-errata@mail.example.it>",
    "to": "preventivi@officine-fittizie.example",
    "subject": "Quote request - stainless steel tanks",
    "receivedAt": "2026-10-16T11:00:00+02:00",
    "body": "Hello,\nI am Thomas Becker from Brauhaus Lindenhof GmbH. We would like a quote for 3 stainless steel fermentation tanks, delivered to our brewery in Bolzano by the end of March.\nVAT number: DE 1234 5678\nBest regards\nThomas Becker",
    "from": "Thomas Becker <t.becker@brauhaus-lindenhof.example>"
  },
  "expected": {
    "classification": "richiesta_preventivo",
    "lead": {
      "fullName": "Thomas Becker",
      "title": null,
      "company": "Brauhaus Lindenhof GmbH",
      "email": "t.becker@brauhaus-lindenhof.example",
      "phone": null,
      "productOrService": "stainless steel fermentation tanks",
      "quantity": "3",
      "urgency": "by the end of March",
      "missingFields": [
        "vatNumberInvalid"
      ],
      "source": "email",
      "originalLanguage": "en",
      "vatNumber": null
    },
    "requests": [
      {
        "productOrService": "stainless steel fermentation tanks",
        "quantity": "3"
      }
    ],
    "missingFields": [
      "vatNumberInvalid"
    ],
    "draft": {
      "register": "formal_en",
      "language": "en",
      "mustAsk": [
        "vatNumberInvalid"
      ],
      "mustNotInventPrices": true,
      "allowedAmounts": [],
      "mustListItemsAsBullets": false,
      "mustAskPriority": false,
      "mustMention": [],
      "mustNotMention": [
        "DE12345678",
        "1234 5678"
      ],
      "autonomousSend": false,
      "expectedSalutationContains": "Dear Mr Becker",
      "piiCheck": true,
      "note": "Numero tedesco di 8 cifre (ne servono 9): errato al controllo formale. Bozza in inglese che chiede di ricontrollarlo."
    },
    "flow": {
      "praticaAction": "create",
      "crmUpsertExpected": 1,
      "expectedStatusAfterPipeline": "draft_ready",
      "telegramButtons": [
        "Approva",
        "Modifica",
        "Scarta"
      ],
      "sendAllowedOnlyAfterApprove": true,
      "telegramLanguage": "it"
    }
  },
  "notes": "Numero IVA estero con la forma sbagliata.",
  "tenantConfig": {
    "requireVatNumber": false
  }
}