{
  "id": "017-multi-prodotto",
  "tags": [
    "multi_request",
    "formal",
    "complete"
  ],
  "specRefs": [
    "§6-multi",
    "§7.2-14"
  ],
  "email": {
    "messageId": "<017-multi-prodotto@mail.example.it>",
    "to": "preventivi@officine-fittizie.example",
    "subject": "Preventivo attrezzature cucina",
    "receivedAt": "2026-10-15T17:00:00+02:00",
    "body": "Buongiorno,\nper il Ristorante Due Ponti (Pisa, via Lungarno Fittizio 3) chiediamo preventivo per:\n- 1 abbattitore di temperatura 5 teglie\n- 2 frigoriferi verticali 700 l\n- 1 lavastoviglie a capotta\nConsegna entro metà dicembre. P.IVA 00000750133.\nIrene Basile",
    "from": "Irene Basile <irene.basile@ristorante-due-ponti.example>"
  },
  "expected": {
    "classification": "richiesta_preventivo",
    "lead": {
      "fullName": "Irene Basile",
      "title": null,
      "company": "Ristorante Due Ponti",
      "email": "irene.basile@ristorante-due-ponti.example",
      "phone": null,
      "productOrService": "attrezzature cucina (3 voci)",
      "quantity": null,
      "urgency": "entro metà dicembre",
      "missingFields": [],
      "source": "email",
      "originalLanguage": "it",
      "vatNumber": "00000750133"
    },
    "requests": [
      {
        "productOrService": "abbattitore di temperatura 5 teglie",
        "quantity": "1"
      },
      {
        "productOrService": "frigorifero verticale 700 l",
        "quantity": "2"
      },
      {
        "productOrService": "lavastoviglie a capotta",
        "quantity": "1"
      }
    ],
    "missingFields": [],
    "draft": {
      "register": "lei",
      "language": "it",
      "mustAsk": [],
      "mustNotInventPrices": true,
      "allowedAmounts": [],
      "mustListItemsAsBullets": true,
      "mustAskPriority": true,
      "mustMention": [
        "abbattitore",
        "frigorifer",
        "lavastoviglie"
      ],
      "mustNotMention": [],
      "autonomousSend": false,
      "mustNotAskVatNumber": true,
      "piiCheck": true
    },
    "flow": {
      "praticaAction": "create",
      "crmUpsertExpected": 1,
      "expectedStatusAfterPipeline": "draft_ready",
      "telegramButtons": [
        "Approva",
        "Modifica",
        "Scarta"
      ],
      "sendAllowedOnlyAfterApprove": true,
      "praticheExpected": 1,
      "telegramLanguage": "it"
    }
  },
  "notes": "",
  "tenantConfig": {
    "requireVatNumber": false
  }
}