{
  "id": "002-completo-servizio-pulizie",
  "tags": [
    "complete",
    "formal",
    "service"
  ],
  "specRefs": [
    "§7.2-11",
    "§7.2-12",
    "§7.2-17",
    "§7.2-18"
  ],
  "email": {
    "messageId": "<002-completo-servizio-pulizie@mail.example.it>",
    "to": "preventivi@officine-fittizie.example",
    "subject": "Preventivo pulizie uffici",
    "receivedAt": "2026-10-15T11:00:00+02:00",
    "body": "Gentili,\nper lo Studio Lumen Associati chiedo un preventivo per la pulizia dei nostri uffici di 180 mq in via dei Ciclamini 4, Bologna, 3 volte a settimana, a partire da novembre.\nMi può contattare al 333 0000222.\nGrazie\nPaolo Annunziata",
    "from": "Paolo Annunziata <p.annunziata@studio-lumen.example>"
  },
  "expected": {
    "classification": "richiesta_preventivo",
    "lead": {
      "fullName": "Paolo Annunziata",
      "title": null,
      "company": "Studio Lumen Associati",
      "email": "p.annunziata@studio-lumen.example",
      "phone": "333 0000222",
      "productOrService": "pulizia uffici 180 mq, 3 volte a settimana",
      "quantity": "1",
      "urgency": "da novembre",
      "missingFields": [],
      "source": "email",
      "originalLanguage": "it",
      "vatNumber": null
    },
    "requests": [
      {
        "productOrService": "pulizia uffici 180 mq, 3 volte a settimana",
        "quantity": "1"
      }
    ],
    "missingFields": [],
    "draft": {
      "register": "lei",
      "language": "it",
      "mustAsk": [],
      "mustNotInventPrices": true,
      "allowedAmounts": [],
      "mustListItemsAsBullets": false,
      "mustAskPriority": false,
      "mustMention": [],
      "mustNotMention": [],
      "autonomousSend": false,
      "expectedSalutationContains": "Gentile Signor Annunziata",
      "mustNotAskVatNumber": true,
      "piiCheck": true
    },
    "flow": {
      "praticaAction": "create",
      "crmUpsertExpected": 1,
      "expectedStatusAfterPipeline": "draft_ready",
      "telegramButtons": [
        "Approva",
        "Modifica",
        "Scarta"
      ],
      "sendAllowedOnlyAfterApprove": true,
      "telegramLanguage": "it"
    }
  },
  "notes": "",
  "tenantConfig": {
    "requireVatNumber": false
  }
}