{
  "id": "034-non-commerciale-candidatura",
  "tags": [
    "non_commercial",
    "job_application"
  ],
  "specRefs": [
    "A4"
  ],
  "email": {
    "messageId": "<034-non-commerciale-candidatura@mail.example.it>",
    "to": "preventivi@officine-fittizie.example",
    "subject": "Candidatura spontanea",
    "receivedAt": "2026-10-14T16:00:00+02:00",
    "body": "Buongiorno, vi invio la mia candidatura spontanea come impiegata commerciale. Resto a disposizione per un colloquio. Sofia Liguori",
    "from": "Sofia Liguori <sofia.liguori@posta-fittizia.example>"
  },
  "expected": {
    "classification": "non_commerciale",
    "lead": null,
    "requests": [],
    "missingFields": [],
    "draft": null,
    "flow": {
      "praticaAction": "notify_only",
      "crmUpsertExpected": 0,
      "expectedStatusAfterPipeline": "logged",
      "telegramButtons": [],
      "sendAllowedOnlyAfterApprove": true,
      "telegramLanguage": "it",
      "telegramNotice": "notifica breve, nessuna bozza"
    }
  },
  "notes": "",
  "tenantConfig": {
    "requireVatNumber": false
  }
}