{
  "id": "030-encoding-qp-html",
  "tags": [
    "encoding",
    "html",
    "formal",
    "complete"
  ],
  "specRefs": [
    "§5.2-encoding",
    "§7.2-11"
  ],
  "email": {
    "messageId": "<030-encoding-qp-html@mail.example.it>",
    "to": "preventivi@officine-fittizie.example",
    "subject": "=?UTF-8?Q?Richiesta_preventivo_etichettatrice_=E2=80=93_urgente?=",
    "receivedAt": "2026-10-13T12:00:00+02:00",
    "body": "<p>Buongiorno,</p><p>sono Nicol=C3=B2 Cant=C3=B9 della Vinicola La Perla S.r.l. di Canel=\nli (AT). Vorrei un preventivo per 1 etichettatrice semiautomatica per bottiglie, entro l&#39;inizio della vendemmia tardiva (fine ottobre). P.IVA 00000700468.</p><p>Grazie &amp; saluti</p>",
    "from": "=?UTF-8?Q?Nicol=C3=B2_Cant=C3=B9?= <nicolo.cantu@vinicola-perla.example>"
  },
  "expected": {
    "classification": "richiesta_preventivo",
    "lead": {
      "fullName": "Nicolò Cantù",
      "title": null,
      "company": "Vinicola La Perla S.r.l.",
      "email": "nicolo.cantu@vinicola-perla.example",
      "phone": null,
      "productOrService": "etichettatrice semiautomatica per bottiglie",
      "quantity": "1",
      "urgency": "entro fine ottobre",
      "missingFields": [],
      "source": "email",
      "originalLanguage": "it",
      "vatNumber": "00000700468"
    },
    "requests": [
      {
        "productOrService": "etichettatrice semiautomatica per bottiglie",
        "quantity": "1"
      }
    ],
    "missingFields": [],
    "draft": {
      "register": "lei",
      "language": "it",
      "mustAsk": [],
      "mustNotInventPrices": true,
      "allowedAmounts": [],
      "mustListItemsAsBullets": false,
      "mustAskPriority": false,
      "mustMention": [],
      "mustNotMention": [],
      "autonomousSend": false,
      "expectedSalutationContains": "Gentile Signor Cantù",
      "mustNotAskVatNumber": true,
      "piiCheck": true
    },
    "flow": {
      "praticaAction": "create",
      "crmUpsertExpected": 1,
      "expectedStatusAfterPipeline": "draft_ready",
      "telegramButtons": [
        "Approva",
        "Modifica",
        "Scarta"
      ],
      "sendAllowedOnlyAfterApprove": true,
      "telegramLanguage": "it"
    }
  },
  "notes": "Header RFC2047 e corpo quoted-printable + HTML: il parser deve decodificare prima dell'estrazione.",
  "tenantConfig": {
    "requireVatNumber": false
  }
}