{
  "id": "013-formale-molto-formale",
  "tags": [
    "formal",
    "complete",
    "title"
  ],
  "specRefs": [
    "§7.2-17",
    "§6-titoli"
  ],
  "email": {
    "messageId": "<013-formale-molto-formale@mail.example.it>",
    "to": "preventivi@officine-fittizie.example",
    "subject": "Richiesta di offerta - quadri elettrici",
    "receivedAt": "2026-10-14T13:00:00+02:00",
    "body": "Spett.le Ditta,\ncon la presente la sottoscritta Ing. Valeria Morelli, per conto di Impianti Morelli Srl, richiede cortese offerta per n. 4 quadri elettrici di distribuzione IP65, da consegnarsi presso il cantiere di Lecce entro il 30 novembre p.v.\nP.IVA 05566778899.\nDistinti saluti",
    "from": "Ing. Valeria Morelli <v.morelli@impianti-morelli.example>"
  },
  "expected": {
    "classification": "richiesta_preventivo",
    "lead": {
      "fullName": "Valeria Morelli",
      "title": "Ing.",
      "company": "Impianti Morelli Srl",
      "email": "v.morelli@impianti-morelli.example",
      "phone": null,
      "productOrService": "quadri elettrici di distribuzione IP65",
      "quantity": "4",
      "urgency": "entro il 30 novembre",
      "missingFields": [],
      "source": "email",
      "originalLanguage": "it",
      "vatNumber": "05566778899"
    },
    "requests": [
      {
        "productOrService": "quadri elettrici di distribuzione IP65",
        "quantity": "4"
      }
    ],
    "missingFields": [],
    "draft": {
      "register": "lei",
      "language": "it",
      "mustAsk": [],
      "mustNotInventPrices": true,
      "allowedAmounts": [],
      "mustListItemsAsBullets": false,
      "mustAskPriority": false,
      "mustMention": [],
      "mustNotMention": [],
      "autonomousSend": false,
      "expectedSalutationContains": "Gentile Ing. Morelli",
      "mustNotAskVatNumber": true,
      "piiCheck": true
    },
    "flow": {
      "praticaAction": "create",
      "crmUpsertExpected": 1,
      "expectedStatusAfterPipeline": "draft_ready",
      "telegramButtons": [
        "Approva",
        "Modifica",
        "Scarta"
      ],
      "sendAllowedOnlyAfterApprove": true,
      "telegramLanguage": "it"
    }
  },
  "notes": "",
  "tenantConfig": {
    "requireVatNumber": false
  }
}