{
  "id": "005-completo-solo-persona",
  "tags": [
    "complete",
    "formal",
    "no_company"
  ],
  "specRefs": [
    "§7.2-11",
    "§7.2-12",
    "§4.1-fullName-o-company"
  ],
  "email": {
    "messageId": "<005-completo-solo-persona@mail.example.it>",
    "to": "preventivi@officine-fittizie.example",
    "subject": "Preventivo scaffalature",
    "receivedAt": "2026-10-15T14:00:00+02:00",
    "body": "Buongiorno, vorrei un preventivo per 6 scaffalature metalliche h 2 m per il mio garage a Treviso (via dei Tigli 9), entro dicembre. Sono un privato, non ho partita IVA. Grazie, Elena Cortivo",
    "from": "Elena Cortivo <elena.cortivo@posta-fittizia.example>"
  },
  "expected": {
    "classification": "richiesta_preventivo",
    "lead": {
      "fullName": "Elena Cortivo",
      "title": null,
      "company": null,
      "email": "elena.cortivo@posta-fittizia.example",
      "phone": null,
      "productOrService": "scaffalature metalliche h 2 m",
      "quantity": "6",
      "urgency": "entro dicembre",
      "missingFields": [],
      "source": "email",
      "originalLanguage": "it",
      "vatNumber": null
    },
    "requests": [
      {
        "productOrService": "scaffalature metalliche h 2 m",
        "quantity": "6"
      }
    ],
    "missingFields": [],
    "draft": {
      "register": "lei",
      "language": "it",
      "mustAsk": [],
      "mustNotInventPrices": true,
      "allowedAmounts": [],
      "mustListItemsAsBullets": false,
      "mustAskPriority": false,
      "mustMention": [],
      "mustNotMention": [
        "partita IVA"
      ],
      "autonomousSend": false,
      "expectedSalutationContains": "Gentile Signora Cortivo",
      "note": "Privato: non chiedere P.IVA; company null è valido perché c'è fullName. A3: privato, P.IVA mai chiesta.",
      "mustNotAskVatNumber": true,
      "piiCheck": true
    },
    "flow": {
      "praticaAction": "create",
      "crmUpsertExpected": 1,
      "expectedStatusAfterPipeline": "draft_ready",
      "telegramButtons": [
        "Approva",
        "Modifica",
        "Scarta"
      ],
      "sendAllowedOnlyAfterApprove": true,
      "telegramLanguage": "it"
    }
  },
  "notes": "",
  "tenantConfig": {
    "requireVatNumber": false
  }
}