{
  "id": "031-mittente-non-valido",
  "tags": [
    "invalid_sender"
  ],
  "specRefs": [
    "§6-mittente-invalido",
    "A2"
  ],
  "email": {
    "messageId": "<031-mittente-non-valido@mail.example.it>",
    "to": "preventivi@officine-fittizie.example",
    "subject": "Richiesta dal form contatti",
    "receivedAt": "2026-10-14T13:00:00+02:00",
    "body": "Nome: Ottavio Riva\nAzienda: Riva Costruzioni\nEmail: ottavio.riva(at)rivacostruzioni\nMessaggio: preventivo per 10 ponteggi a Monza",
    "from": "Modulo sito <>"
  },
  "expected": {
    "classification": "richiesta_preventivo",
    "lead": {
      "fullName": "Ottavio Riva",
      "title": null,
      "company": "Riva Costruzioni",
      "email": null,
      "phone": null,
      "productOrService": "ponteggi",
      "quantity": "10",
      "urgency": null,
      "missingFields": [
        "email",
        "deliverySite"
      ],
      "source": "email",
      "originalLanguage": "it",
      "vatNumber": null
    },
    "requests": [
      {
        "productOrService": "ponteggi",
        "quantity": "10"
      }
    ],
    "missingFields": [
      "email",
      "deliverySite"
    ],
    "draft": null,
    "flow": {
      "praticaAction": "log_only",
      "crmUpsertExpected": 0,
      "expectedStatusAfterPipeline": "failed",
      "telegramButtons": [],
      "sendAllowedOnlyAfterApprove": true,
      "sendReplyExpected": 0,
      "telegramLanguage": "it",
      "telegramNotice": "avviso senza pulsanti: mittente non valido, pratica solo registrata"
    }
  },
  "notes": "",
  "tenantConfig": {
    "requireVatNumber": false
  }
}